{
  "schema_version": 1,
  "repository": {
    "owner": "frostyard",
    "name": "example",
    "repository_id": "123456789"
  },
  "accountable_owners": [
    {
      "kind": "github-user",
      "login": "bketelsen"
    }
  ],
  "fleet_state": "enabled",
  "maintenance_programs": ["quality", "ci"],
  "action_ceiling": ["read", "write", "run-tests", "open-pr"],
  "surface_contract_version": 1
}
